{
  "id": "linkedin-2026-04-01-devlog",
  "created_at": "2026-04-01T21:45:00-05:00",
  "source_date": "2026-04-01",
  "source_project": "Luna_Export",
  "artifact_type": "linkedin_post",
  "publish_target": "linkedin",
  "status": "approved",
  "approved": true,
  "public_safe": false,
  "title": "LinkedIn Draft: Phase 1 Export Pipeline",
  "summary": "Placeholder LinkedIn post generated from tonight's export staging work.",
  "tags": [
    "linkedin",
    "devlog",
    "phase1"
  ],
  "related_files": [
    "exports/approved/linkedin/2026-04-01-linkedin-post.md"
  ],
  "screenshot_files": [],
  "notes": "Seed artifact for validating pending-to-approved promotion."
}
